{
  "schemaVersion": "1.0",
  "id": "grid.filezzim.001",
  "name": "FileZzim Grid Guard Service Pair",
  "vendor": "unverified",
  "family": "webhard-grid-component",
  "description": "Candidate process and service pair recovered from the statically verified Grid Killer EA06 target table.",
  "confidence": "strong-inference",
  "status": "candidate",
  "sources": [
    "docs/evidence/M03_EXTRACTION_ATTEMPT.md",
    "docs/analysis/INDICATOR_PROVENANCE.md"
  ],
  "match": {
    "all": [
      { "type": "executablePath", "operator": "containsIgnoreCase", "value": "\\FileZzimGService.exe" },
      { "type": "serviceName", "operator": "equalsIgnoreCase", "value": "_FILEZZIM_GGUARD_" }
    ]
  },
  "exclusions": [],
  "score": 70,
  "response": {
    "terminateProcess": false,
    "stopService": false,
    "disableService": false,
    "removePersistence": false,
    "quarantineFiles": false,
    "permanentDelete": false
  },
  "createdAt": "2026-07-27T06:40:00Z",
  "updatedAt": "2026-07-27T06:40:00Z"
}
